"Id","Name","Address","County","Country","Phone","Website","Activities","PersonResponsibleName","PersonResponsibleEmail","PersonResponsibleTelephone","Email","CompanyRegistrationNumber","CompanyRegisteredName","CompanyRegisteredAddress","CharityRegulationNumber","CHYNumber"
"889","Drinks Industry Group of Ireland","Anglesea House, Anglesea Road, Ballsbridge, Dublin, D04 V094, Dublin","Dublin","Ireland","016680215","www.drinksindustry.ie","Industry body","Donall O'Keeffe","admin@lva.ie","016680215",,,,,,
"1995","Dromahair Arts and Recreation Centre Association Limited by Guarantee","Station Road, Dromahair, F91 CD66, Leitrim","Leitrim","Ireland","0868583646","dromahairarc.com","Other (Sports & Recreation Facilities)","Jim Meehan","jim.meehan@yahoo.ie","0862331593",,"500349","DROMAHAIR ARTS & RECREATION CENTRE ASSOCIATION COMPANY LIMITED BY GUARANTEE","STATION ROAD DROMAHAIR CO. LEITRIM ",,
"1563","Dromcollogher Community Council","Pike Street, Dromcollogher, Co. Limerick, Dromcollogher, Limerick","Limerick","Ireland","0868218871",,"Other (local community projects and events)","John O'Dell","Dromcouncil@gmail.com","0868218871",,,,,,
"1481","Druid Performing Arts","Flood Street, Galway, Galway, H91PWX5, Galway","Galway","Ireland","091 568660","www.druid.ie","Other (Theatre)","Feargal Hynes","feargal.hynes@druid.ie","0863674455",,"120786","DRUID PERFORMING ARTS LIMITED","CHAPEL LANE GALWAY  ",,"6800"
"139","Drury | Porter Novelli","17a Gilford Rd, Sandymount, Dublin, D04 K4XO, Dublin","Dublin","Ireland","012605000","www.drurypn.ie","Other (Public Relations and Public Affairs)","Gerry Naughton","gerry.naughton@drurypn.ie","2605000",,,"Drury Communications Limited trading as Drury | Porter Novelli","17 a Gilford Rd , Sandymount, Dublin D04 K4XO",,
"1490","Dubco Credit Union Limited","Little Green Street, Dublin 7, Dublin","Dublin","Ireland","018870400","www.dubco.ie","Other (Credit Union)","Michael Ahern","michael.ahern@dubco.ie","018870400",,,,,,
"1329","Dublin 15 Community Council","Buzzardstown House, Castlecurragh, Mulhuddart, Mulhuddart, D15Y361, Dublin","Dublin","Ireland","0863618766","www.dublin15cc.com","Other (Community Council)","Cecilia Durnin","celia.durnin@gmail.com","0863618766",,,,,,
"806","Dublin Adult Learning Centre","3 Mountjoy Square, Dublin 1, Dublin, 1, Dublin","Dublin","Ireland","018787266","www.dalc.ie","Other (provision of basic education services)","Mary Maher","marymaher@dalc.ie","018787266",,"276151","DUBLIN ADULT LEARNING CENTRE","3 MOUNTJOY SQUARE DUBLIN 1  ","20037635","12674"
"783","Dublin AIDS Alliance CLG trading as HIV Ireland","70 Eccles Street, Dublin, D07 A977, Dublin","Dublin","Ireland","01-8733799","www.hivireland.ie","Health","Niall Mulligan","niall.mulligan@hivireland.ie","01-8733799",,"206162","DUBLIN AIDS ALLIANCE COMPANY LIMITED BY GUARANTEE","70 ECCLES STREET DUBLIN 7  ",,"10858"
"465","Dublin Bus","59 Upper O'Connell Street, Dublin, Dublin 1, Dublin","Dublin","Ireland","017033131","www.dublinbus.ie","Other (Public Transport)","Jennifer O'Brien","jennifer.obrien@dublinbus.ie","017033131",,"119569","BUS ATHA CLIATH - DUBLIN BUS","59 UPPER O'CONNELL STREET, DUBLIN, 1  ",,
"85","Dublin Chamber of Commerce","7 Clare Street, Dublin, 2, Dublin","Dublin","Ireland","016447200","www.dublinchamber.ie","Industry body","Patrick King","patrick@dublinchamber.ie","016447227",,"588","DUBLIN CHAMBER OF COMMERCE (INCORPORATED)","7, CLARE STREET, DUBLIN 2.  ",,
"832","Dublin City Business Improvement District T/A DublinTown","Abbey House,, Level 1, 43-45 Middle Abbey Street, Dublin 1, Dublin 1, Dublin","Dublin","Ireland","016334680","www.wearedublintown.ie","Industry body","Richard Guiney","richard@dublintown.ie","0879661455",,,"DUBLIN CITY CENTRE BID COMPANY LIMITED","Abbey House, Level 1, 43-45 Middle Abbey Street, Dublin 1.","N/A","N/A"
"1347","Dublin City Buskers","75 Dame Street, 11-12 Crampton Court, Dublin 2, D02 X754, Dublin","Dublin","Ireland","+353874646303","www.dublincitybuskers.com","Other (Representative organisation)","Roibeard O Cadhain","director@dublincitybuskers.com","0867266519",,,,,,
"1907","Dublin City Interfaith Forum","c/o Rotunda Foundation, Pillar Room, Rotunda Hospital, Parnell Square, Dublin","Dublin","Ireland","015677174","https://www.dublincityinterfaithforum.org/","Other (Encourage people of different faiths in the Dublin area to dialogue, reflect and  work toget her in matters of policy, strategy and action.)","Adrian Cristea","adrian@dublincityinterfaithforum.org","0838003345",,"568329","DUBLIN CITY INTERFAITH FORUM COMPANY LIMITED BY GUARANTEE","CLONLIFFE COLLEGE CLONLIFFE ROAD DUBLIN 3 ","Pending",
"1846","Dublin Independent Host Network","2 ARNWOOD, BLACKHORSE AVENUE, DUBLIN 7, Dublin","Dublin","Ireland","086 8867234","Over 5 years","Other (Hospitality - Short Term Rentals)","Susan Brady","bradysusan8@gmail.com","086 8867234",,,,,,
"656","Dublin Inner City Community Cooperative Society Limited","22 Lower Buckingham Street, Dublin 1, Dublin, Dublin","Dublin","Ireland","0876909184","www.dublincitycommunitycoop.ie","Other (Community Development in Dublin's inner city, primarily Dublin 1,3, 7 and 8)","Noel Wardick","nwardick@dublincitycommunitycoop.ie","0876909184",,,"5628 R","22 Lower Buckingham Street Dublin 1",,
"78","Dublin International Insurance & Management Association (DIMA)","Pavilion House, 31/32 Fitzwilliam Square, Dublin, D2, Dublin","Dublin","Ireland","+35317759448","www.dima.ie","Industry body","Eddy Van Cutsem","eddy.vancutsem@dima.ie","+35317759448",,"394270","THE DUBLIN INTERNATIONAL INSURANCE & MANAGEMENT ASSOCIATION COMPANY LIMITED BY GUARANTEE","PAVILION HOUSE 31/32 FITZWILLIAM SQUARE DUBLIN 2 ",,
"677","Dublin North West Area Partnership","Rosehill House, Finglas Road, Finglas, 11, Dublin","Dublin","Ireland","01 8361666","www.dnwap.ie","Other (Local economic and social Inclusion)","Michael Bowe","michael.bowe@dnwap.ie","01 8361666",,"219145","DUBLIN NORTH WEST AREA PARTNERSHIP COMPANY LIMITED BY GUARANTEE","ROSEHILL HOUSE, FINGLAS ROAD, DUBLIN 11 ","11574","11574"
"152","Dublin Rape Crisis Centre","70 Lower Leeson Street, Dublin, D02 VW13, Dublin","Dublin","Ireland","01 6614911","www.drcc.ie","Other (Operate 24 Hr Helpline, Counselling, Training, Education, Awareness-Raising)","Noeline Blackwell","noeline@rcc.ie","01 6614911",,"147318","THE DUBLIN RAPE CRISIS CENTRE LIMITED","70 LOWER LEESON STREET DUBLIN 2  ","8529","8529"
"338","Dublin Simon Community","1-2 Cope street, Dublin, Dublin 2, Dublin, Dublin","Dublin","Ireland","016715363","www.dubsimon.ie","Other (Homeless, housing and treatement service provider)","Pat Greene","patgreene@dubsimon.ie","016715363",,"32955","DUBLIN SIMON COMMUNITY","1/2 COPE STREET DUBLIN 2  ","20009892","5963"
"588","Dublin Solicitors Bar Association","First Floor, 54 Dawson Street, Dublin 2, Dublin, Dublin","Dublin","Ireland","+353 (1) 6706 089","http://www.dsba.ie/","Other (The Dublin Solicitors Bar Association (""DSBA"") is a representational and not a regulatory organisation existing to promote the welfare and interests of its members, who are Solicitors.)","Eamonn Shannon - President","maura@dsba.ie","01 6706089",,,,,,
"1424","Dublin West Childcare & Learning Services CLG","Bawnogue Enterprise centre, Bawnogue Road, Clondalkin, Dublin 2, Dublin","Dublin","Ireland","014579355",,"Other (Provision of Community Early Years Education & Care)","Elaine Mc Quillan","manager@dublinwestchildcare.ie","0860486313",,"405583","DUBLIN WEST CHILDCARE AND LEARNING SERVICES COMPANY COMPANY LIMITED BY GUARANTEE","BAWNOGUE ENTERPRISE CENTRE BAWNOGUE ROAD CLONDALKIN DUBLIN 22","19199","19199"
"801","Dun Laoghaire Combined Clubs","21, Sandycove Ave East, Sandycove, Dun Laoghaire, A96 EH50, Dublin","Dublin","Ireland","0872434388",,"Other (Voluntary combination of six Dun Laoghaire waterfront clubs engaged in the promotion of the sport of sailing and watersports generally)","Liam Owens","liam.owens4@gmail.com","0872434388",,,,,,
"691","Dun Laoghaire Rathdown Chamber of Commerce","Kilcullen HOuse, 1 Haigh Terrace, Dun Laoghaire, Co. Dublin, A96 P6P8, Dublin","Dublin","Ireland","01/2845066","www.dlrchamber.ie","Other (Business to Business)","Gabby Mallon","gabby@dlrchamber.ie","01/2845066",,,"Dun Laoghaire Rathdown Chamber of Commerce","1 Haigh Terrace, Dun Laoghaire, Co. Dublin",,
"1812","Dundalk Chamber","Partnership Court, Park Street, Dundalk, Louth","Louth","Ireland","0868244098","www.dundalk.ie","Lobbying","Paddy Malone","paddy@malone.ie","0868244098",,,"Dundalk Chamber of Commerce Incorporated","Parnership Court, Dundalk Co. Louth",,
"910","Dundalk Institute of Technology","Dublin Road, Dundalk, A91K584, Louth","Louth","Ireland","0429370221","https://www.dkit.ie","Other (Third Level Education)","Gerald O Driscoll","gerald.odriscoll@dkit.ie","042970221",,,,,"20028824","CHY 10925"
"442","Dungarvan & West Waterford Chamber","Unit S32, The Plaza, Dungarvan, WD, Waterford","Waterford","Ireland","+353866043602","http://www.dungarvanchamber.ie/","Other (Supporting Business)","Jenny Beresford","jenny@dungarvanchamber.ie","+353866043602",,,"Dungarvan Chamber Of Commerce and Industry Limited","Unit S32, Block A, The Plaza, Dungarvan, Co. Waterford",,
"1278","Dyslexia Association of Ireland","5th Floor, Block B, Joyce's Court, Talbot Street, Dublin 1, Dublin, D01 C861, Dublin","Dublin","Ireland","Rosie Bissett","www.dyslexia.ie","Other (educational charity)","Rosie Bissett","ceo@dyslexia.ie","018776001",,"185795","DYSLEXIA ASSOCIATION OF IRELAND","5TH FLOOR BLOCK B JOYCE'S COURT TALBOT STREET DUBLIN 1","20025335","10044"
"1217","Dyspraxia Association of Ireland","Carmichael Centre, Nth.Brunswick Street, dublin, 7, Dublin","Dublin","Ireland","018747085","www.dyspraxia.ie","Health","harry conway","info@dyspraxia.ie","087 2257623",,,"Dyspraxia Association of Ireland","Carmichael Centre",,"13394"
"661","D??nall Geoghegan","33 St. Pappin's Green, Glasnevin, Dublin 11, D11 V1H5, Dublin","Dublin","Ireland","+353 87 222 5691",,"Lobbying",,"donallg@gmail.com",,,,,,,
"577","D??chas na Gaillimhe - Galway Civic Trust","Hall of the Red Earl, Custom House, Druid Lane, Galway, H91XV2C, Galway","Galway","Ireland","091 564946","http://www.galwaycivictrust.ie/","Other (Heritage, Education, Culture.)","Eugene Jordan","chair@galwaycivictrust.ie","+353863939584",,"208155","GALWAY CIVIC TRUST - DUCHAS NA GAILLIMHE","CUSTOM HOUSE DRUID LANE GALWAY ","20030704","CHY 11312"
"401","D??n Laoghaire Business Improvement District","101 Upper Georges Street, D??n Laoghaire, Dublin","Dublin","Ireland","01 9035327",,"Industry body","JP Montgomery","jp@dunlaoghaire.ie","019035327",,"533339","BID DL COMPANY LIMITED BY GUARANTEE","1 UPPER GEORGES STREET DUN LAOGHAIRE CO. DUBLIN ",,
"690","Early Childhood Ireland","Hainault House, Belgard Square South, Tallaght, D24 RFV0, Dublin","Dublin","Ireland","01 405 7100","www.earlychildhoodireland.ie","Other (The representative and support body for early childhood education and care in Ireland.)","Teresa Heeney","theeney@earlychildhoodireland.ie","01 405 7100",,"506235","ECCE & PLAY EARLY CHILDHOOD IRELAND","HAINAULT HOUSE BELGARD SQUARE SOUTH TALLAGHT DUBLIN 24","20078904","19987"
"631","EastWest Mapping","Clonegal, Enniscorthy, -, Wexford","Wexford","Ireland","0539377835","www.eastwestmapping.ie","Other (Cartography and map publishing)","Barry Dalby","info@eastwestmapping.ie","0539377835",,,,,,
"828","Eaton Corporation plc","Eaton House, 30 Pembroke Road, Dublin 4, Ballsbridge, D04 Y0C2, Dublin","Dublin","Ireland","+353(0)16372876","www.eaton.com","Manufacturing","Taras Szmagala","tarasgszmagala@eaton.com","+14405234502",,,"Eaton Corporation plc","Eaton House, 30 Pembroke Road, Dublin 4, Ireland",,
"686","Ecocem Ireland","Unit F1 East Point Office Park, Dublin, 3, Dublin","Dublin","Ireland","01 678 1800","http://www.ecocem.ie/","Manufacturing","Andrew McGrane","amcgrane@ecocem.ie","01 678 1800",,"282625","ECOCEM IRELAND LIMITED","BLOCK F1 EASTPOINT DUBLIN 3 ",,
"1873","ecohouse developments limited","unit 518A Grants Crescent, Greenogue Business Park, Rathcoole County Dublin, Dublin, Dublin","Dublin","Ireland","0868121765","www.ecohouse.ie","Construction","Fergus Lowndes","fergus@ecohouse.ie","0868121765",,"569973","ECOHOUSE DEVELOPMENTS LIMITED","UNIT 518A GRANTS CRESCENT GREENOGUE BUSINESS PARK RATHCOOLE DUBLIN 24",,
"464","Ecumenical Accompaniment Programme in Palestine and Israel","QPSW, Friends House, 173 Euston Road, LONDON, LONDON, NW1 2BJ",,"United Kingdom","0207-663-1073","eappi@quaker.org.uk","Other (Human Rights Advocacy)","Teresa Parker","teresap@quaker.org.uk","0207-663-1073",,,"Britain Yearly Meeting","Friends House, 173 Euston Road, LONDON NW1 2BJ","1127633",
"779","Edelman Ireland","5th Floor, Huguenot House, 35-38 St. Stephen's Green, Dublin 2, Dublin, Dublin","Dublin","Ireland","01 6789333","www.edelman.ie","Other (Communications Marketing)","Jane Ryan","jane.ryan@edelman.com","01 6789333",,"84139","DANIEL J. EDELMAN IRELAND LIMITED","HUGUENOT HOUSE, 35 ST. STEPHEN'S GREEN, DUBLIN 2. ",,
"1504","Edgeworthstown District Development Association Ltd","Old Schoolhouse, Ballymahon Rd., Edgeworthstown, Longford, Longford","Longford","Ireland","0436671801","www.edgeworthstown.net","Other (Community Development)","Carmel Noone","edgelocdev@eircom.net","0436671801",,,"Edgeworthstown District Development Association Ltd","Ballymahon Rd. Edgeworthstown County Longford",,
"427","Educate Together","11 - 12 Hogan Place, Dublin, 2, Dublin","Dublin","Ireland","014292500","www.educatetogether.ie","Other (Setting up equality-based schools in Ireland and developing Ethical Education)","Luke O'Shaughnessy","luke.oshaughnessy@educatetogether.ie","014292500",,"286202","EDUCATE TOGETHER/AG FOGHLAIM LE CHEILE","11-12 HOGAN PLACE DUBLIN 2  ",,"CHY 11816"
"711","Education and Training Boards Ireland","Pipers Hill, Kilcullen Road, Naas, Kildare","Kildare","Ireland","045-901070","www.etbi.ie","Other (National Representative Association for Education and Training Boards)","Michael Moriarty, General Secretary","Michael.Moriarty@etbi.ie","045-901070",,,,,,
"1642","edward  Hogan","4 Hanlons Lane, Malahide, dublin, irl1",,"Ireland","+353872523355",,"Construction",,"ed@emhogan.ie",,,,,,,
"159","Edward Dillon & Co. Ltd.","Estuary House, Eastpoint Business Park, Fairview, Dublin, D03Y6A2, Dublin","Dublin","Ireland","01 8193300","www.edwarddillonco.ie","Other (Drinks Distributor)","Barry Costello","barry.costello@edwarddillonco.ie","018193364",,"4305","EDWARD DILLON & CO., LIMITED","ESTUARY HOUSE, BLOCKP7 EAST POINT BUSINESS PARK, FAIRVIEW,DUBLIN 3",,
"1452","EFNA","11 Rue D'Egmont, Brussels, 1000",,"Belgium","+32486688134","www.efna.net","Health","Heather CLARKE","euaffairs@efna.net","+32486688134",,,"European Federation of Neurological Associations","11 Rue D'Egmont","(ASBL) #0543319269","n/a"
"63","eircom Limited","1 Heuston South Quarter, St John's Road, Dublin, Dublin 8, Dublin","Dublin","Ireland","085 1744292","www.eir.ie","Communications/Electronics","Patrick Galvin","pat.galvin@eir.ie","085 1744292",,"98789","EIRCOM LIMITED","1 HEUSTON SOUTH QUARTER ST JOHNS ROAD DUBLIN 8 ",,
"804","Elanco Animal Health, Eli Lilly and Company Limited","Lilly House, Priestley Road,, Basingstoke, Hampshire, RG249NL",,"United Kingdom","00 44 1256 353131","www.elanco.com","Health","George Tice","tice_george_a@elanco.com","|+353 86 0441039",,,,,,
"507","Elavon Financial Services DAC","Building E, Cherrywood Business Park, Loughlinstown, D18 W319, Dublin","Dublin","Ireland","012423183",,"Finance","Claire Ryan","Claire.Ryan@elavon.com","012423183",,"418442","ELAVON FINANCIAL SERVICES DESIGNATED ACTIVITY COMPANY","2ND FLOOR, BLOCK E CHERRYWOOD SCIENCE & TECHNOLOGY PARK, LOUGHLINSTOWN, CO.DUBLIN",,
"1307","Electrical Contractors Safety & Standards Association  (Ireland) Ltd","Coolmore House, Park Road, Killarney, Kerry","Kerry","Ireland","064 6637266","www.ecssa.ie","Other (Trade & Training Association)","Mike Marshall","info@ecssa.ie","064 6637266",,,"Electrical Contractors Safety & Standards Association (Ireland) Ltd","Coolmore House, Park Road, Killarney, Co Kerry",,
"34","Electricity Association of Ireland (EAI)","127 Baggot Street Lower, Dublin 2, Ireland, Dublin, Dublin 2, Dublin","Dublin","Ireland","+353 87 2369999","www.eaireland.com","Energy & Natural Resources","Owen Wilson","owen.wilson@eaireland.com","+353 87 2369999",,"443598","ELECTRICITY ASSOCIATION OF IRELAND LIMITED","127 BAGGOT STREET LOWER DUBLIN 2  ",,
"1132","Electricity Supply Board","27, Lower Fitzwilliam Street, Dublin, D02 KT92, Dublin","Dublin","Ireland","01 6765831","http://www.esb.ie","Energy & Natural Resources","Marie Sinnott","marie.sinnott@esb.ie","01 7027651",,,"N/A","N/A","N/A","N/A"
"1158","Element Power Ireland Limited","Unit C, Building 4200, Cork Airport Business Park, Cork, Cork","Cork","Ireland","+353(0)212427786",,"Energy & Natural Resources","Gerda O'Donovan","gerda.odonovan@elpower.com","+353(0)212427786",,"487313","ELEMENT POWER IRELAND LIMITED","UNIT C BUILDING 4200 CORK AIRPORT BUSINESS PARK CORK",,
"1458","Eli Lilly","Dunderrow, Kinsale, Cork","Cork","Ireland","021 477 2699",,"Manufacturing","Christopher Langan","langan_christopher_r@lilly.com","021 470 3616",,,,,,
"2006","ELSA Community Services clg t/a ELSA Security","Security Office, Bell Bulding, Darndale Belcamp Village Centre, Darndale, Dublin 17, Dublin","Dublin","Ireland","085 801 5255",,"Other (Social Enterprise - Security Services -)","Tom Daly","tom.daly@elsasecurity.com","0858015255",,"453050","ELSA COMMUNITY SERVICES COMPANY LIMITED BY GUARANTEE","SECURITY OFFICE DARNDALE BELCAMP VILLAGE CENTRE DUBLIN 17 ",,
"1119","Emer Costello","66 Aughrim Street, Dublin 7, Dublin","Dublin","Ireland","+353863831805",,"Other (Postgraduate Student)",,"emeracostello@gmail.com",,,,,,,
"1298","Enable Ireland Disability Services Ltd","32F Rosemount Park Drive, Rosemount Business Park, Ballycoolin Road, Dublin 11, Dublin","Dublin","Ireland","01 866 5200","www.enableireland.ie","Health","Theresa Compagno","hrcorporateaffairs@enableireland.ie","021 4290434",,,"Enable Ireland Disability Services Ltd","32F Rosemount Park Drive, Rosemount Business Park, Ballycoolin Road, Dublin 11","20006617","4908"
"1482","Enclude Ltd","Drumcondra Business Centre, 120 Drumcondra Road Upper, Drumcondra, D09T6P7, Dublin","Dublin","Ireland","0857130794","www.enclude.ie","Other (Non-profit IT support)","Patricia HIggins","patricia.higgins@enclude.ie","0876394231",,"442488","ENCLUDE COMPANY LIMITED BY GUARANTEE","120 DRUMCONDRA BUSINESS CENTRE DRUMCONDRA ROAD UPPER DUBLIN 9 ","CRA 20064006","CHY 17286"
"1159","ENERCON ENERCON GmbH Irish Branch","Unit 14 Northwood House,, Northwood Business Campus, Santry, Dublin","Dublin","Ireland","(0)1-8934020",,"Energy & Natural Resources","Wilke Janssen","wilke.janssen@enercon.de","+49 160 989 77 774",,,,,,
"969","enet","Hamilton House, National Technological Park, Plassey, Limerick, V94 TRW8, Limerick","Limerick","Ireland","061 274000","www.enet.ie","Communications/Electronics","Niall Beirne","niall.beirne@enet.ie","0876125426",,,"e-nasc Eireann Teoranta","Hamilton House, National Technological Park, Plassey, Limerick, V94 TRW8",,
"151","Engineers Ireland","22 Clyde Road, Ballsbridge, D04R3N2, Dublin","Dublin","Ireland","016651300","www.engineersireland.ie","Industry body","Michelle Hoctor","mhoctor@engineersireland.ie","016651377",,,"Institution of Engineers in Ireland","22 Clyde Road, Ballsbridge, Dublin 4",,
"191","Ennis Chamber of Commerce","54 O'Connell Street, Ennis, v95v3kd, Clare","Clare","Ireland","0656842988","www.ennischamber.ie","Lobbying","Margaret Neylon","info@ennischamber.ie","0656842988",,"160082","ENNIS CHAMBER OF COMMERCE","54, O'CONNELL ST., ENNIS, CO CLARE ",,
"956","Enniscorthy & District Chamber","Enniscorthy Castle, Castle Hill, Enniscorthy, Wexford","Wexford","Ireland","00353539232006","www.enniscorthychamber.ie","Other (Promotion of Business, Enterprise, Tourism, Industry, Community)","John Burke O'Leary","info@enniscorthychamber.ie","00353872306645",,,"Enniscorthy & District Chamber","Abbey Square, Enniscorthy, Co. Wexford",,
"440","Environmental Communications Consultants LImited (ECCL)","82 Burnaby Heights, Greystones, Wicklow","Wicklow","Ireland","0862547949","eccl.ie","Other (Communications Consultancy)","Kieran O'Byrne","kobyrne@eccl.ie","0862547949",,"521761","ENVIRONMENTAL COMMUNICATIONS CONSULTANTS LIMITED","82 BURNABY HEIGHTS GREYSTONES CO.WICKLOW ",,
"857","Environmental Pillar","MACRO Centre, 1 Green St, Dublin, dublin 7, Dublin","Dublin","Ireland","01 8780116","www.environmentalpillar.ie","Other (Environmental NGO)","Michael Ewing","Michael@ien.ie","01 8780116",,,,,,
"1089","Eoghan Horgan Financial Limited trading as EHF Markets","Rathanny House, Rathanny, Tralee, Tralee, Tralee, Kerry","Kerry","Ireland","0894967865",,"Finance","Eoghan Horgan","eoghan.horgan@ehfmarkets.com","089 4967865",,"513286","EOGHAN HORGAN FINANCIAL LIMITED","RATHANNY HOUSE RATHANNY KIELDUFF TRALEE, CO. KERRY",,
"1672","Eoin Loughney","180 Cartur Mor, Clybaun Rd, Galway, Galway","Galway","Ireland","0879380905",,"Finance",,"eoinloughney@gmail.com",,,,,,,
"749","EPIC Empowering People in Care","7 Red Cow Lane, Smithfield, Dublin 7, Dublin, D7, Dublin","Dublin","Ireland","018727661","www.epiconline.ie","Other (Advocacy and support for children in care and with care experience, policy research and participation work.)","Terry Dignan","terrydignan@epiconline.ie","018727661",,,"EPIC","7 Red Cow Lane, Smithfield, Dublin 7.","20055080","381973"
"1523","EPIC IRELAND EXHIBITIONS LIMITED","THE CHQ BUILDING, CUSTOM HOUSE QUAY, DUBLIN, 1, Dublin","Dublin","Ireland","016736054","WWW.EPICIRELANDCHQ.COM","Other (TOURIST ATTRACTION)","MERVYN GREENE","MGREENE@CHQ.IE","0868289063",,,"EPIC IRELAND EXHIBITIONS LIMITED","International House, Castle Hill, Victoria Road, Douglas, Isle of Man IM2 4RB",,
"87","Epilepsy Ireland","249 Crumlin Road, Dublin, 12, Dublin","Dublin","Ireland","01 4557500","www.epilepsy.ie","Health","Peter Murphy","pmurphy@epilepsy.ie","01 4557500",,"77588","BRAINWAVE-THE IRISH EPILEPSY ASSOCIATION","249, CRUMLIN ROAD, DUBLIN 12.  ",,"6170"
"530","EPS Consulting","5 Islington Avenue, Sandycove, Dublin, Dublin","Dublin","Ireland","087 2412001",,"Other (EPS Consulting is a public policy research consultancy)","Peter Brennan","pbrennan@epsconsult.ie","087 2412001",,,"EPS Consulting Limited","as above",,
"640","EQUATE","7 Red Cow Lane, Smithfield, Dublin 7, Dublin","Dublin","Ireland","0863559098","equateireland.ie","Other (Campaigning for Education Reform)","Anthony Muldoon","anthony@equateireland.ie","0863559098",,"569423","EDUCATION EQUALITY COMPANY LIMITED BY GUARANTEE","7 RED COW LANE SMITHFIELD, DUBLIN 7  ",,
"204","Ervia","Webworks, Eglinton Street, Cork, Cork","Cork","Ireland","021-4239000","www.ervia.ie","Energy & Natural Resources","Cecilia Ogle","Cecilia.Ogle@ervia.ie","021-4239336",,,,,,
"2022","European Association of Primary Care Partners","17 Kildare Street, Dublin, D2, Dublin","Dublin","Ireland","0860244888","www.eapcp.com","Health","Brian Downes","brian@eapcp.com","0860244888",,,"European Association of Primary Care Partners CLG","17 Kildare Street, Dublin 2",,
"1522","European Heart Network","Rue Montoyer 31, Brussels, 1000",,"Belgium","+3225129174","http://www.ehnheart.org/","Health","Susanne L??gstrup","slogstrup@ehnheart.org","+3225129174",,,,,,
"157","European Movement Ireland","8 Lower Fitzwilliam St, Dublin, 2, Dublin","Dublin","Ireland","01 662 5815","www.europeanmovement.ie","Other (Irish-EU Affairs)","Noelle O Connell","noelle@europeanmovement.ie","01 662 5815",,"21130","THE EUROPEAN MOVEMENT - IRELAND","8 FITZWILLIAM STREET LOWER DUBLIN 2  ",,
"823","European Multiple Sclerosis Platform","Rue Auguste Lambuiotte 144, Brussels 1030, Brussels",,"Belgium","+353 876965 403","www.emsp.org","Health","Emma Rogan","emma.rogan@emsp.org","+353 876965403",,,,,,
"1444","EUROPEAN PAIN FEDERATION EFIC","Grensstraat 7, box 3, Diegem, 1831",,"Belgium","32 2 251 55 10","www.efic.org","Health","Chris Wells","secretary@efic.org","""2 2 251 55 10",,,"EUROPEAN PAIN FEDERATION EFIC","Grensstraat 7 box 3, 1831 Diegem, Belgium",,
"1015","European Recycling Platform","2-4 Ely Place, Dublin 2, D02 FR58, Dublin","Dublin","Ireland","01  6624040","www.erp-recycling.ie","Industry body","Martin Tobin","martin.tobin@erp-recycling.org","01  6624040",,"404550","EUROPEAN RECYCLING PLATFORM IRELAND LIMITED","2-4 ELY PLACE DUBLIN 2  ",,
"630","Eversheds","One Earlsfort Centre, Earlsfort Terrace, Dublin, Dubline, Dublin","Dublin","Ireland","01 66 44 200",,"Other (Solicitors Firm)","Eoin Mac Aodha","EoinMacAodha@eversheds.ie","01 66 44 200",,,,,,
"842","Exclusive Cigar Manufacturing Ireland Limited","Charlestown Road, Ballaghaderreen, Roscommon","Roscommon","Ireland","0949860220","www.ecmicigars.com","Manufacturing","Aoife O Dowd","aoife.odowd@ecmi.ie","0862262157",,"65558","EXCLUSIVE CIGAR MANUFACTURING IRELAND LIMITED","CHARLESTOWN ROAD, BALLAGHADERREEN, CO. ROSCOMMON. ",,
"1845","Executive Trust Lyd.","Unit 35 Northwood Court, Santry, Dublin 9, Dublin","Dublin","Ireland","01 8441985","www.europcar.ie","Other (Car Rental)","Sinead Brennan","sinead.brennan@europcar.ie","01 8441985",,,,,,
"1688","Extern","Unit B, Block B, Kreston House, Arran Quoy, Arran Court, Dublin, D07 K271, Dublin","Dublin","Ireland","+44 (0)28 9084 0555","WWW.EXTERN.ORG","Lobbying","Gavin Adams","gavin.adams@extern.org","07436791381",,,,,"383201","CHY15770"
"894","EY","Harcourt Centre, Harcourt Street, Dublin 2, Dublin, Dublin","Dublin","Ireland","01 475 0555",,"Other (Professional services)","Suzanne Tucker","Suzanne.Tucker@ie.ey.com","01 475 0555",,,,,,
