"Id","Name","Address","County","Country","Phone","Website","Activities","PersonResponsibleName","PersonResponsibleEmail","PersonResponsibleTelephone","Email","CompanyRegistrationNumber","CompanyRegisteredName","CompanyRegisteredAddress","CharityRegulationNumber","CHYNumber"
"332","Irish Underwater Council","78a Patrick street, Dun Laoghaire, Dublin, Dublin","Dublin","Ireland","012844601","www.diving.ie","Other (Natioanl Governing Body of Underwater Sport)","Sinead Burke","secretary@diving.ie","01 2844601",,"196745","COMHAIRLE FO-THUINN - IRISH UNDERWATER COUNCIL","78A, PATRICK STREET D??N LOAGHAIRE CO. DUBLIN ",,
"931","Irish Universities Association","48 Merrion Square, Dublin, D02 PK02, Dublin","Dublin","Ireland","01-6764948","www.iua.ie","Other (Promote the development of education and research in Irish universities.)","Aidan Mullany","aidan.mullany@iua.ie","01-6764948",,,"Irish Universities Association","48 Merrion Square, Dublin 2",,"12359"
"553","Irish Vape Vendors Association","41 Pearse Street, Ballina, Mayo","Mayo","Ireland","0894600690",,"Industry body","Gillian Golden","admin@ivva.ie","0894600690",,,"IRISH VAPE VENDORS ASSOCIATION LIMITED","41 Pearse Street, Ballina, Co Mayo",,
"906","Irish Venture Capital Association","3 Rectory Slopes, Bray, Wicklow","Wicklow","Ireland","353 1 2764647","www.ivca.ie","Industry body","Regina Breheny","reginabreheny@ivca.ie","087 0517754",,,"The Irish Venture Capital Association Limited","William Fry Solicitors, Fitzwilton House, Wilton Place, Dublin 2",,
"433","Irish Warmblood Studbook Ltd","14 Carrowgar, Ogonnelloe, Scarriff, V94 TR52, Clare","Clare","Ireland","087-222-9701","www.irish-warmblood.com","Agribusiness","Thomas Reed","tom@irish-warmblood.com","087-827-4831",,"465817","IRISH WARMBLOOD STUDBOOK LIMITED","14 CARROWGAR OGONNELLOE SCARRIFF CO. CLARE",,
"1785","Irish Water","Colvill House, 24-26 Talbot Street, Dublin 1, Dublin, Dublin","Dublin","Ireland","01-8925000","www.water.ie","Energy & Natural Resources","Suzanne Collins","press@water.ie","0871458896",,"530363","IRISH WATER","COLVILL HOUSE 24/26 TALBOT STREET DUBLIN 1 ",,
"333","Irish Wheelchair Association (IWA)","Irish Wheelchair Association, Blackheath Drive, Clontarf, Dublin, D03AW62, Dublin","Dublin","Ireland","01 818 6400","www.iwa.ie","Other (Service Provider)","Joan Carthy","joan.carthy@iwa.ie","018186497",,"352483","I.W.A. COMPANY LIMITED BY GUARANTEE","ARAS CHUCHULAIN BLACKHEATH DRIVE CLONTARF DUBLIN 3","CHY5393","CHY5393"
"892","Irish Wildlife Trust CLG.","Sigmund Business Centre, 93A Lagan Road, Glasnevin, Dublin 11, Dublin","Dublin","Ireland","+35318602839","www.iwt.ie","Other (Conservation of wildlife and the habitats upon which it depends throughout Ireland.)","Peter Cuffe","iwtsecretary@gmail.com","+353872542630",,"85061","IRISH WILDLIFE TRUST COMPANY LIMITED BY GUARANTEE","SIGMUND BUSINESS CENTRE, 93A, LAGAN ROAD, DUBLIN INDUSTRIAL ESTATE, GLASNEVIN, DUBLIN 11.","20010966","6264"
"342","Irish Wind Energy Association","Sycamore House, Milennium Business Park, Osberstown, Naas, W91 D627, Kildare","Kildare","Ireland","045899341","www.iwea.com","Energy & Natural Resources","Gary Healy","adam@iwea.com","045899341",,"352773","IWEA COMPANY LIMITED BY GUARANTEE","SYCAMORE HOUSE MILLENIUM PARK, OBERSTOWN, NAAS CO.KILDARE",,
"383","Irving Oil Whitegte Refinery Ireland","Whitegate, Midleton, P25 HD93, Cork","Cork","Ireland","0877982049",,"Energy & Natural Resources","Mike King","mike.king@irvingoil.com","0877982049",,,"Irving Oil Whitegate Holdings LIMITED","70 Sir John Rogerson's Quay, Dublin 2, Ireland",,
"1434","IS&WFPO Ltd.","The Pier, Castletownbere, Beara, ROI, Cork","Cork","Ireland","0862360001","www.irishsouthandwest.ie","Other (Fish Producers Organisation)","PATRICK MURPHY","southwest@eircom.net","0862360001",,,"IS&WFPO Ltd.","The Pier",,
"1133","ISC Intelligence in Science","14b Rue de la Science, Brussels, 1040",,"Belgium","+32494346040","www.iscintelligence.com","Other (Science programme management)","Declan KIRRANE","declan.kirrane@iscintelligence.com","+32494346040",,,,,,
"563","ITFMA","Derryvally, Ballybay, Monaghan","Monaghan","Ireland","0035342974861","itfma.ie","Construction","Peter McCaughey","Peter.McCaughey@ijmtimberframe.com","04771711",,"290680","IRISH TIMBER FRAME MANUFACTURERS ASSOCIATION LIMITED","DERRYVALLY BALLYBAY CO. MONAGHAN ",,
"922","ITMAC - Irish Tobacco Manufacturers' Advisory Committee","The Greenhouse, 6th floor, Block E, Mountainview, Leopardstown, Dublin, D18, Dublin","Dublin","Ireland","0872717241","http://www.itmac.ie/","Industry body","Martina Branconi","martina_branconi@bat.com","0872717241",,,,,,
"1932","ITOA - Incoming Tour Operators Association Ireland","PO Box 65, Bray, Co Wicklow, Bray, Wicklow","Wicklow","Ireland","012861113","www.itoa-ireland.com","Industry body","Ruth Andrews","randrews@itoa-ireland.com","012861113",,,,,,
"1254","Its Good 2 Talk Counselling & Support Service Limited","Block B, Old County Council Buildings, Spawell Road, 0000, Wexford","Wexford","Ireland","053 91 26596","www.itsgood2talk.com","Other (Counselling & Support for the Wexford Community)","Bernadette Quinn Fahy","ber.maxboley@gmail.com","086 1550115",,,"It's Good 2 Talk Counselling Psychotherapy Support Services Limited","Block B, Old county Council Buildings, Spawell Road, Wexford.","Chy 20982","20982"
"1603","J.O.S Solicitors","Gray Office Park, Headford Road, Galway City, Galway","Galway","Ireland","091 511 460/ 01 482 6931","www.jossolicitors.ie","Other (Law & Lobbying)","Jason O' Sullivan","jason@jossolicitors.ie","091 511 460/ 01 482 6931",,,"J.O.S Solicitors","Gray Office Park, Headford Road, Galway.",,
"1627","James McCarthy","Noizay",,"France","Not published",,"Other (Lobbying against rezoning of land in the Rosshill area of Galway City Development Plan 2017 2023)",,"ocmac@yahoo.com",,,,,,,
"1387","James Mooney","86 Jamestown Road, Inchicore, Dublin 8, Dublin, DO8 YK24, Dublin","Dublin","Ireland","0872456677",,"Construction",,"jmooney@tribeach.com",,,,,,,
"1570","Jan van Dijk","Mill House, Mill Street, Dundalk, A91XTF7, Louth","Louth","Ireland","+353429354466",,"Construction",,"jvandijk@vandijkarchitects.com",,,,,,,
"289","Jane Doyle","71 Carysfort Avenue, Blackrock, A94Y3YO, Dublin","Dublin","Ireland","+87 6263918",,,,"janedoyle71@gmail.com",,,,,,,
"976","Janssen Biologics (Ireland)","Barnahely, Ringaskiddy, Cork","Cork","Ireland","0214973204",,"Manufacturing","john fenton","jfento@its.jnj.com","0214973204",,"391741","JANSSEN BIOLOGICS (IRELAND)","BARNAHELY, RINGASKIDDY, CO. CORK. ",,
"481","Janssen Cilag Ltd","Airton Road, Tallaght, Dublin","Dublin","Ireland","+ 353 14665200","www.janssen.ie","Health","Conor Sweeney","csweene4@its.jnj.com","+353 860886972",,,,,,
"1908","Janssen Sciences Ireland UC","Eastgate Village, Eastgate, Little Island, Cork","Cork","Ireland","+ 353 21-4673500","www.janssen.ie","Manufacturing","Conor Sweeney","csweene4@its.jnj.com","0860886972",,"472372","JANSSEN SCIENCES IRELAND UC","EASTGATE VILLAGE EASTGATE LITTLE ISLAND CO. CORK",,
"1534","Japanese Knotweed Ireland Ltd","Granig, Minane bridge, Cork, Cork, Cork","Cork","Ireland","0874574112","www.japaneseknotweedireland.ie","Other (Control and treatment of Invasive Non Native Plant species in Ireland)","David Hyde","david@japaneseknotweedireland.ie","0874574112",,"568857","JAPANESE KNOTWEED IRELAND LIMITED","GRANIG MINANE BRIDGE CO. CORK ",,
"1911","JCDecaux Ireland Ltd","6 Sandyford Park, Burton Hall Road, Dublin, D18 AT28, Dublin","Dublin","Ireland","01 295 8170","www.jcdecaux.ie","Other (Outdoor media and funding public services via advertising)","Joanne Grant","joanne.grant@jcdecaux.ie","+447968122084",,"318760","JCDECAUX IRELAND LIMITED","6 SANDYFORD PARK BURTON HALL ROAD LEOPARDSTOWN DUBLIN 18.",,
"44","Jesuit Centre for Faith and Justice","26 Sherrard Street Upper, Dublin, 1, Dublin","Dublin","Ireland","018556814","www.jcfj.ie","Other (Public awareness on social justice issues, social research, theological reflection, advocacy/lobbying)","Eoin Carroll","ecarroll@jcfj.ie","018556814",,,"Jesuit Centre for Faith and Justice","26 Sherrard Street Upper, Dublin 1","CHY6965","6965"
"744","Jim Leyden","Cloverhill, Ballybride Road, Rathmichael, Dublin, D18K7H9, Dublin","Dublin","Ireland","0868188888",,"Other (homeowner)",,"jiml@bizquip.ie",,,,,,,
"1984","Jim Long","43 Pine tree Close, Ballinacurra Gardens, Limerick, V947PM7, Limerick","Limerick","Ireland","0851529902",,"Lobbying",,"jameslongmo@yahoo.ie",,,,,,,
"1016","Jim O'Donohoe","Donabate, Dublin","Dublin","Ireland","0863694316",,"Other (Retired lecturer)",,"jimodonohoe35@gmail.com",,,,,,,
"210","Jim Walsh","36 The Drive, Millbrook Lawns, Tallaght, Dublin, 24, Dublin","Dublin","Ireland","08972541700",,"Lobbying",,"jim@walshpr.ie",,,,,,,
"1894","Jimmy McGettigan","Culmore, Derry, Derry","Derry","United Kingdom","Not published",,"Other (Management of rental properties)",,"culmoremagim@gmail.com",,,,,,,
"1209","JKP Nursing Home Ltd. T/A Altadore nursing home","Upper Glenageary Road, Glenageary, Dublin","Dublin","Ireland","01-2807551","www.altadorenursinghome.ie","Health","James O Reilly","admin@altadorenursinghome.ie","0872801166",,"483964","JKP NURSING HOME LIMITED","ALTADORE NURSING HOME UPPER GLENAGEARY ROAD GLENAGEARY CO. DUBLIN",,
"627","JKS Communications","Denshaw House, 121 Baggot Street Lower, Co Dublin, Duboin, D02FD45, Dublin","Dublin","Ireland","086 9174239","www.jkscommunications.ie","Other (public affairs, advoacy and single issue campaigns)","Jimmy Smyth","jsmyth@jkscommunications.ie","086 9174239",,"507938","JKS COMMUNICATIONS LIMITED","DENSHAW HOUSE 121 LOWER BAGGOT STREET DUBLIN 2 ",,
"1372","Jobcare","The Exchange, 50 Gardiner Street Lower, Dublin, D01 VC03, Dublin","Dublin","Ireland","0876370932","www.jobcare.ie","Other (Charitable services for long-term unemployed people)","Paul Mooney","paul@jobcare.ie","0876370932",,"215563","JOBCARE","THE EXCHANGE 50 GARDINER STREET LOWER DUBLIN 1 ","20030643","11301"
"552","Joe Bonner Planning","127 Lower Baggot Street, Dublin 2, Dublin, 2, Dublin","Dublin","Ireland","0877509637","www.joebonerplanning.ie","Other (Town Planning Consultant)","Joe Bonner","info@joebonnerplanning.ie","0877509637",,,"Joe Bonner Town Planning Consultant","22 Kingshall, Cahpelizod, Dublin 20",,
"1029","Joe Corbett","Spancilhill, Ennis, V95 A0HP, Clare","Clare","Ireland","087 2682594",,"Lobbying",,"joecorbettclare@gmail.com",,,,,,,
"1850","John Buttery","Lisready, Loughill, V94E2K7, Limerick","Limerick","Ireland","0879888326",,"Other (Private Citizen)",,"jgabuttery@gmail.com",,,,,,,
"1237","John Doyle","4 dargle Court Apt, Greenpark Road, Bray, Wicklow","Wicklow","Ireland","0879530443",,"Other (Disability Activist)",,"darglecourt@gmail.com",,,,,,,
"829","John Ellis","15 College Green, Dublin City, Dublin, Dublin","Dublin","Ireland","087 6793561",,"Communications/Electronics",,"john@johnellis.ie",,,,,,,
"317","John Gallagher","27 Villarea Park, Glenageary, Co Dublin, Dublin, Dublin","Dublin","Ireland","0879369888","www.jgconsult.org","Lobbying","John Gallagher","jgconsult@iol.ie","0879369888",,,,,,
"1662","John Gilroy","9 Hazelwood Court, Glanmire, Cork","Cork","Ireland","0857759893",,"Lobbying",,"johngilroy01@gmail.com",,,,,,,
"862","John Horan","Sonas, 10 Deerpark Green, Blessington, W91 DX27, Wicklow","Wicklow","Ireland","0868075619",,"Other (Seeking support for development of Blessington Greenway)",,"jhah@eircom.net",,,,,,,
"861","John Mangan","Tobergregan, Garristown, Dublin","Dublin","Ireland","Not published",,"Other (Farming)",,"mmangan@gofree.indigo.ie",,,,,,,
"622","John Player","21 Beckett Way, Park West Business Park, Dublin, Dublin, 12, Dublin","Dublin","Ireland","012434809","n/a","Other (Sales & Distribution of Tobacco Products)","Deirdre Healy","deirdre.healy@ie.imptob.com","012434809",,"21912","JOHN PLAYER & SONS LIMITED","21 BECKETT WAY PARK WEST NANGOR ROAD DUBLIN 12",,
"477","John Prenty","Knock Road, Ballyhaunis, Ballyhaunis, Mayo","Mayo","Ireland","+353872417139",,"Other (CEO Connacht GAA)",,"johnprenty52@gmail.com",,,,,,,
"1851","John Sisk & Son Ltd","Wilton Works, Naas Road, Clondalkin, Dublin, D18, Dublin","Dublin","Ireland","0868091208","www.sisk.ie","Construction","Mark McGreevy","m.mcgreevy@sisk.ie","0868091208",,"241278","JOHN SISK & SON (HOLDINGS) LIMITED","WILTON WORKS NAAS ROAD CLONDALKIN DUBLIN 22",,
"494","John Smith","12 Meadow Close, Newtownpark Avenue, Blackrock, 0000, Dublin","Dublin","Ireland","0872544545",,"Energy & Natural Resources",,"johnsmith.irl@gmail.com",,,,,,,
"1050","John Spain Associates","39 Fitzwilliam Place, Dublin 2, Dublin, 2, Dublin","Dublin","Ireland","016625803",,"Other (Consultancy)","John Spain","jspain@johnspainassociates.com","016625803",,"396306","JOHN SPAIN ASSOCIATES LIMITED","39 FITZWILLIAM PLACE DUBLIN 2  ",,
"709","John v Farrelly","Hurdlestown, Kells, County Meath, Kells, A82x6HO",,"Ireland","0862585154",,"Lobbying",,"johnvfarrelly@gmail.com",,,,,,,
"605","Johny Janssens","Skylark Hill, Newcastle, Co. Dublin, Dublin, none, Dublin","Dublin","Ireland","00353872611133",,"Other (Hospitality and Retirement facilities)",,"jjanssens@lamberton.ie",,,,,,,
"432","Joseph Goodfellow","Whitethorn House, Ballybrit, Briarhill, Galway, none, Galway","Galway","Ireland","0877765206",,"Other (Floating restaurant)",,"joefgoodfellow@gmail.com",,,,,,,
"1623","JPMorgan Chase Bank, National Association","25 Bank Street, Canary Wharf, Floor 30, London, E14 5JP",,"United Kingdom","+44 207 1349249",,"Finance","Richard Kaye","kaye_richard@jpmorgan.com","+44 207 1349249",,,,,,
"568","JRI America Inc","JRI America, Innovation Works, Kerry Technology Park, Tralee, Kerry","Kerry","Ireland","066 7178802",,"Other (IT SERVICES)","Shane Walsh","swalsh@jri-america.com","066 717 8802",,"906680","JRI AMERICA, INC.","KERRY TECHNOLOGY PARK KNOCKAWADRA ROAD TRALEE COUNTY KERRY",,
"355","JTI Ireland Limited","4-6 Riverwalk, Citywest Business Campus, Dublin, 24, Dublin","Dublin","Ireland","01 4040200","www.jti.com","Other (Tobacco Sales & Distribution)","Cheryl Cullen","cheryl.cullen@jti.com","01 4040200",,"378922","JTI IRELAND LIMITED","1ST FLOOR BLOCK 4-6 RIVER WALK CITYWEST BUSINESS CAMPUS DUBLIN 24",,
"900","Justin Byrne","17 Finnspark, Lucan, Codublin, Dublin","Dublin","Ireland","Not published",,"Other (environment)",,"justin.byrne42@gmail.com",,,,,,,
"1952","K&L Gates, LLP","1601 K Street, N.W., Washington, D.C., 20006",,"United States","+1 202 778 9321","www.klgates.com","Other (Law Firm)","James Thomas Walsh","jim.walsh@klgates.com","+1202 778 9321",,,,,,
"1933","K King Construction Claregalway Ltd","Technology House, Galway Technology Park, Parkmore, Galway, Galway","Galway","Ireland","0872525112",,"Construction","Walter King","walter@kingconstruction.ie","0872525112",,,,,,
"919","Karl McCoy [KMPC Consulting]","KMPC Consulting, Ballinora, Waterfall, Cork, T12FTX0, Cork","Cork","Ireland","+353214214349",,"Other (Chartered Surveyor [Planning + Development])",,"kmccoy@kmpc.ie",,,,,,,
"1556","Katie Marie-Anne O'Connor","Not published",,,"Not published",,"Other (Industry, Enterprise and Commerce)",,"Not published",,"Not published",,,,,
"1801","Kavcre La Touche Limited","4 Inver Mews, Old Chapel Ground, Arklow, Wicklow","Wicklow","Ireland","0858684037",,"Construction","Niall O'Byrne","niall.obyrne@newgen.ie","0858664227",,,"Kavcre La Touche Limited","4 Inver Mews, Old Chapel Ground, Arklow, Co. Wicklow",,
"379","KBC Bank Ireland","Sandwith Street, Dublin 2, Dublin, Dublin","Dublin","Ireland","016646000","www.kbc.ie","Finance","Aidan Power","Aidan.Power@kbc.ie","016646372",,"40537","KBC BANK IRELAND PUBLIC LIMITED COMPANY","SANDWITH STREET, DUBLIN 2.  ",,
"350","KBC group nv","HAVENLAAN 2, BRUSSELS, 1080",,"Belgium","+32 495 598163","www.kbc.be","Finance","luk van eylen","luk.vaneylen@kbc.be","+32 2 429 3280",,,,,,
"670","Keating & Associates","19, Fitzwilliam Place, Dublin 2, D02 FP71, Dublin","Dublin","Ireland","016620345","www.keating.ie","Other (Public Relations)","Sean Perry","sean@keating.ie","016620345",,"186612","BARBERRY LIMITED","19, FITZWILLIAM PLACE, DUBLIN 2.  ",,
"1694","Keelings Group","Keelings, FoodCentral, St. Margarets, Co. Dublin, Dublin","Dublin","Ireland","018135600","www.keelings.com","Agribusiness","Lorraine Kirwan","lorraine_kirwan@keelings.com","018135600",,"43181","KEELINGS","FOODCENTRAL, ST.MARGARETS, CO.DUBLIN ",,
"950","Kells & District Chamber Ltd","Unit 6, KETC, Kells Business Park, Kells, Meath","Meath","Ireland","0469240055","www.kellschamber.ie","Other (Business organisation)","Bill Sweeney","info@kellschamber.ie","046 9240055",,,"Kells & District Chamber Ltd","Carrick St Kells",,
"1864","Ken Campbell","Ardross, Kilconnell, Ballinasloe, H53RV04, Galway","Galway","Ireland","0877654200",,"Lobbying",,"kencam74@gmail.com",,,,,,,
"1789","Kennedy Wilson Europe Limited","1st Floor, 33 Sir John Rogerson's Quay, Dublin 2, Dublin","Dublin","Ireland","+442071235604",,"Other (Management of Real Estate / Investment Advisory Services)","Padmini Singla","psingla@kennedywilson.eu","+442071235604",,"498779","KENNEDY WILSON EUROPE LIMITED","1ST FLOOR 33 SIR JOHN ROGERSON'S QUAY DUBLIN 2 ",,
"1834","Kerry Co-Operative Creameries Limited","Princes Street, Tralee, V92 EH11, Kerry","Kerry","Ireland","0667182000",,"Agribusiness","Mundy Hayes","mundyhayes16@gmail.com","0863911051",,,,,,
"524","Kerry Parents & Friends Association","The Old Monastery, Port Road, Killarney, V93 WK68, Kerry","Kerry","Ireland","0646632742","www.kpfa.ie","Health","Marie Linehan","marie.linehan@kpfa.ie","0868518618",,,"Kerry Parents & Friends Association","Old Monastery Port Road Killarney Co. Kerry","112184","6871"
"380","Kerry Rape and Sexual Abuse Centre","5 Greenview Terrace, Princes Quay, Tralee, Kerry","Kerry","Ireland","066 7123122","www.krsac.com","Other (Counselling)","Vera OLeary","veraol@eircom.net","087 2600130",,,"Kerry Rape & Sexual Abuse Centre","5 Greenview Terrace. tralee. County Kerry","11760","10562"
"642","Kevin's Hurling & Camogie Club","Rear 25A Donore Avenue, Rialto, Dublin 8, Dublin, 8, Dublin","Dublin","Ireland","0868078324","www.kevins.ie","Other (Sports Club)","Mary Crampton","mgcrampton@yahoo.ie","0868078324",,,,,,
"1580","Kevin Flanigan","Not published",,,"Not published",,"Other (estate agent)",,"kevinfflanigan@gmail.com",,,,,,,
"1768","Key Capital Limited","Huguenot House, 35-38 St Stephens Green, Dublin, Dublin 2",,"Ireland","0035316383848","www.keycapital.ie","Other (Investment & Finance)","Alma Mackin","alma.mackin@keycapital.ie","016383848",,,"KCII Limited","Huguenot House, St Stephens Green",,
"1713","Keystone Procurement","Ardenagh Great, Ballymitty, Y35 RY91, Wexford","Wexford","Ireland","0857132514","www.keystonepg.ie","Other (Consultancy and thought leadership)","Ross McCarthy","ross@keystonepg.ie","0857132514",,"550631","KEYSTONE PROCUREMENT LIMITED","ARDENAGH GREAT BALLYMITTY CO. WEXFORD ",,
"1695","Kieran Buckley","141 Castleland Court, Balbriggan, Balbriggan, Dublin","Dublin","Ireland","0857333336",,"Lobbying",,"buckleykieran@ymail.com",,,,,,,
"1007","Kieran Rush Consult Ltd","24 Templeville Rd, Templeogue, Dublin 6w, n/a, Dublin","Dublin","Ireland","0872513013","Kieran Rush Consult Ltd","Construction","Kieran Rush","kieranrush@gmail.com","0872513013",,"496229","KIERAN RUSH CONSULT LIMITED","24 TEMPLEVILLE ROAD TEMPLEOGUE DUBLIN 6W ",,
"1881","Kildare Youth Services","Units 34/35, Naas Town Centre, Naas, Kildare","Kildare","Ireland","0876658221","www.kys.ie","Other (Services for Children, Young People and Families)","Tom Dunne, CEO","tom.dunne@kys.ie","0863359992",,,"Kildare Youth Services","Units 34/35, Naas Town Centre, Naas, Co. Kildare",,"14564"
"853","Kilian McGreal","The Stone Cottage, Humphriestown, Blessington, w91k757, Wicklow","Wicklow","Ireland","0864075689",,"Health",,"kilian@mcgreals.ie",,,,,,,
"746","Kilkenny Chamber of Commerce & Industry Ltd","The Maltings, Tilbury Place, James Street, Kilkenny, R95 T97W, Kilkenny","Kilkenny","Ireland","0567752767","www.kilkennychamber.ie","Other (Representation of business interests)","John Hurley","john@kilkennychamber.ie","0862740581",,"295415","KILKENNY CHAMBER OF COMMERCE & INDUSTRY LIMITED","THE MALTINGS KILKENNY  ",,
"1263","Kilkenny Council of Trade Unions","c/o Noreside Resource Centre, 3 St Canices Court, Dean Street, Kilkenny City, Kilkenny","Kilkenny","Ireland","+353567807313","www.kilkennyunions.com","Trade union","Philip Funchion","pkfunchion@yahoo.com","+353879710690",,,,,,
"1258","Kilkenny LEADER Partnership","8 Patricks Court, Patrick Street, Kilkenny, Kilkenny","Kilkenny","Ireland","0872540965","www.cklp.ie","Other (Non-profit local development activity)","Declan Rice","declan.rice@cklp.ie","0872540965",,"454899","COUNTY KILKENNY LEADER PARTNERSHIP COMPANY LIMITED","8 PATRICKS COURT PATRICK STREET KILKENNY ","CHY18191","CHY18191"
"1251","Killarney Chamber of Tourism & Commerce","Beech Rd, Killarney, Kerry","Kerry","Ireland","064-6637928","www.killarney.ie","Industry body","Tom Randles","tom@randleshotels.com","064-6635333",,,,,,
"423","Killruddery Estate Enterprises Limited","Killruddery House, Killruddery, Southern Cross Road, Bray, Wicklow","Wicklow","Ireland","012764815","www.killruddery.com","Other (Operation of Tourism Venue and Estate)","Anthony Brabazon","anthony@killruddery.com","0877729882",,,"Killruddery Estate Enterprises Limited","Killruddery Estate, Southern Cross Road, Bray, Co Wicklow",,
"604","KILLYBEGS FISHERMEN'S ORGANISATION LTD","BRUACH NA MARA, ST CATHERINE'S ROAD, KILLYBEGS, KILLYBEGS, Donegal","Donegal","Ireland","074 9731089","www.kfo.ie","Industry body","Sean O'Donoghue","kfo@kfo.ie","074 9731089",,,"KILLYBEGS FISHERMEN'S ORGANISATION LTD","BRUACH NA MARA, ST CATHERINE'S ROAD, KILLYBEGS, CO DONEGAL",,
"1422","Kilpaddoge Energy Ltd.","Leighmoney, Dunderrow, Kinsale, Kinsale, Cork","Cork","Ireland","0872463433","n/a","Energy & Natural Resources","Peter Harte","peter.harte@yahoo.co.uk","0872463433",,"504029","KILPADDOGE ENERGY LIMITED","TULFARRIS KILBRITTAIN ROAD BANDON CO CORK",,
"1115","kilternan cemetery park limited & park developments group","4th Floor, The Herbert Building, The Park, Carrickmines, Dublin 18, 18, Dublin","Dublin","Ireland","2136000",,"Construction","tim crowley","timcrowley@esatlink.com","0862552808",,,"kilternan cemetery park limited","4th floor, the herbert building, the park, carrickmines, dublin 18",,
"1930","Kingspan Insulated Panels","Carrickmacross Road, Kingscourt, Cavan","Cavan","Ireland","+353429698500","www.kingspanpanels.co.uk","Manufacturing","Bianca Wong","bianca.wong@kingspan.com","+353429698500",,,,,,
"1190","Kirby Group Engineering","Raheen Business Park, Limerick, Limerick, Limerick","Limerick","Ireland","061 226060","www.kirbygroup.com","Construction","Jimmy Kirby","jkirby@kirbygroup.com","01 4540411",,"41839","KIRBY GROUP ENGINEERING","RAHEEN INDUSTRIAL ESTATE LIMERICK  ",,
"1975","Kirwan Action Group","Monument Road, Menlo, Galway, H91NW8X, Galway","Galway","Ireland","0872377751",,"Lobbying","Peter Cunnane","petercunnane@eircom.net","0872377751",,,,,,
"311","KPMG","1 Stokes Place, St Stephen's Green, Dublin 2, D02 DE03, Dublin","Dublin","Ireland","014101000","www.kpmg.ie","Other (Audit, tax and advisory services)","Paul Dobey","paul.dobey@kpmg.ie","014101152",,,,,,
"1129","L'Arche Ireland","42 West Street, Callan, Kilkenny","Kilkenny","Ireland","0567755494","www.larcheireland.org","Health","Mairead Boland-Brabazon","maireadbb@larcheireland.org","0868924965",,,"L'Arche Ireland","42 West Street, Callan, Co. Kilkenny","7979","7979"
"657","L.M. Ericsson Limited","Beech Hill, Clonskeagh, Dublin, 4, Dublin","Dublin","Ireland","+353-207-2000","www.ericsson.com","Communications/Electronics","Gillian McNamara","gillian.mcnamara@ericsson.com","+353-1-207-2285",,"21679","L.M. ERICSSON LIMITED","BEECH HILL, CLONSKEAGH, DUBLIN 4. ",,
"68","Lagan Cement","Lansdown, Killaskillen, Kinnegad, 0000, Westmeath","Westmeath","Ireland","00353449379200","www.lagancement.com","Manufacturing","Martina Keane","martina.keane@lagan-group.com","00353449379297",,"237663","LAGAN CEMENT","KILLASKILLEN KINNEGAD CO. WESTMEATH ",,
"293","Lahiffe & Associates","Pembroke Hall, 38/39 Fitzwilliam Square, Dublin, 2, Dublin","Dublin","Ireland","0872562166",,"Other (Public Affairs and Political Communications)","Frank Lahiffe","frank.lahiffe@hotmail.com","0872562166",,,,,,
"1306","Lakers Social & Recreation Club","The Brady Centre, Seapoint Road, Bray, Wicklow","Wicklow","Ireland","012022694","www.lakers.ie","Other (Intellectual Disabilities)","Anne King","anne.king@lakers.ie","012022694",,"395399","LAKERS SOCIAL AND RECREATION CLUB LIMITED","2 LORETO VILLAS SIDMONTON ROAD BRAY CO. WICKLOW","CHY15208","15208"
"1221","Landis + Gyr","Munster Lodge, Clifton Avenue, Monkstown, Dublin","Dublin","Ireland","0873782859","Www.landisgyr.com","Manufacturing","Simon Egan","simon.egan@landisgyr.com","0873782859",,,,,,
"1297","Laois Community and Enterprise Development Company Ltd t/a Laois Partnership Co","Ground Floor, Block 2, County Hall, Portlaoise, Laois","Laois","Ireland","057 8661900","www.laoispartnership.ie","Other (local development compaany)","Peter O Neill","cnocspa@gmail.com","0578661900",,,"Laois Community and Enterprise Development Company Ltd t/a Laois Partnership Co","Ground Floor Block 2 County Hall Portlaoise Co Laois","20070045","18315"
"1867","Lar McKenna","Straffan, Co. Kildare, Kildare","Kildare","Ireland","Not published",,"Construction",,"larrmck@gmail.com",,,,,,,
"649","Latifat Olagoke","22 Fforster Grove, Ballydowd Manor, Lucan, Dublin, Co. Dub, Dublin","Dublin","Ireland","0871906824",,"Lobbying",,"latifatolagoke@gmail.com",,,,,,,
